{
  "event_id": "0199f0a0-5555-7aaa-9bbb-000000000005",
  "event_type": "data_changed",
  "occurred_at": "2026-10-29T13:00:00Z",
  "data_type": "voiceprint",
  "data_id": "0199f0a0-4444-7aaa-9bbb-000000000004",
  "operation": "created",
  "new_version": 1,
  "old_version": null,
  "root_feedback_id": "system",
  "depth": 0,
  "skip_history": false
}
