{
  "event_id": "0199f0a2-6666-7aaa-9bbb-000000000006",
  "event_type": "data_changed",
  "occurred_at": "2026-10-29T13:05:00Z",
  "data_type": "person",
  "data_id": "0199f09f-3333-7aaa-9bbb-000000000003",
  "operation": "updated",
  "new_version": 3,
  "old_version": 2,
  "root_feedback_id": "0199f0a2-7c3e-7a10-8b2c-4d5e6f708192",
  "depth": 0,
  "skip_history": true
}
